gombe attacks,males kill females and infants in gang attacks
attacks on border females,border females do get attacked as punishment for not being around enough
attacks on humans,chimps will attack human infants 
infanticide in mammals other than primates,pretty common
infanticide adaptive hyp,females who detected offspring were unlikely to survive so just ate them
primate infanticide,none except humans
take over events,othermales try to take over the dominant males and his infants to gain access to females